{
  "id": "a1-1",
  "title": "A1.1 \u2014 Greetings & Basics",
  "description": "Master the fundamentals: greetings, numbers, family, daily routines, and essential phrases for everyday interactions.",
  "themes": [
    {
      "id": "greetings-introductions",
      "title": "Greetings & Introductions",
      "description": "Learn how to greet people, introduce yourself, and handle basic social interactions.",
      "sections": [
        "greetings-introductions"
      ],
      "estimatedHours": 2
    },
    {
      "id": "numbers-colors",
      "title": "Numbers & Colors",
      "description": "Count from 0 to 100, learn colors, and describe objects.",
      "sections": [
        "numbers-colors"
      ],
      "estimatedHours": 2
    },
    {
      "id": "family-people",
      "title": "Family & People",
      "description": "Talk about your family members, describe people, and use possessive adjectives.",
      "sections": [
        "family-people"
      ],
      "estimatedHours": 2
    },
    {
      "id": "daily-routines",
      "title": "Daily Routines",
      "description": "Describe your daily schedule, learn reflexive verbs, and tell time.",
      "sections": [
        "daily-routines"
      ],
      "estimatedHours": 3
    },
    {
      "id": "coffee-shop-ordering",
      "title": "Coffee Shop & Ordering",
      "description": "Order food and drinks, ask for the bill, and learn numbers in context.",
      "sections": [
        "coffee-shop-ordering"
      ],
      "estimatedHours": 2
    },
    {
      "id": "city-exploring",
      "title": "City & Directions",
      "description": "Navigate a city, ask for directions, and describe places.",
      "sections": [
        "city-exploring"
      ],
      "estimatedHours": 2
    },
    {
      "id": "tourist-essentials",
      "title": "Tourist Essentials",
      "description": "Book hotels, ask for help, and handle common tourist situations.",
      "sections": [
        "tourist-essentials"
      ],
      "estimatedHours": 2
    },
    {
      "id": "work-introductions",
      "title": "Work & Introductions",
      "description": "Talk about your job, workplace, and professional background.",
      "sections": [
        "work-introductions"
      ],
      "estimatedHours": 2
    }
  ]
}
